,author,subreddit,score,created,body,label
245,u/BlueRock,RenewableEnergy,0.9281700849533081,2010-11-24 14:42,"Yep. Those pesky safety requirements are a nuisance, but that is the *fortunate* reality. Something as inherently dangerous as nuclear energy needs them otherwise we'd be knee-deep in radioactive material because corporations chase profits over safety every time.

I'll risk a wind turbine toppling over from a nuke spewing out radioactive material any day of the week.",NEG
763,u/InactiveUser,RenewableEnergy,0.48203563690185547,2011-03-16 06:02,"Nuclear energy is safe and clean, you won't see any deaths from Japan.

/GE",NEU
804,u/BlueRock,RenewableEnergy,0.754238486289978,2011-03-19 01:02,"Relevant:

* Nuclear Energy Steals Billions from Other Technologies. http://stephenleahy.net/2010/07/19/nuclear-energy-steals-billions-from-other-technologies/",NEG
822,u/acegibson,RenewableEnergy,0.5246347188949585,2011-03-20 08:48,There's been a tendency from some on reddit to downplay the most recently demonstrated drawbacks of nuclear energy while up-playing the hazards of coal and oil.,NEG
839,u/BlueRock,RenewableEnergy,0.6194201111793518,2011-03-21 11:25,"Relevant:

* Offshore Wind Energy Cheaper than Nuclear Energy, EU Climate Chief Says. http://cleantechnica.com/2011/03/18/offshore-wind-energy-cheaper-than-nuclear-energy-eu-climate-chief-says/",NEU
867,u/VicinSea,RenewableEnergy,0.8767678737640381,2011-03-22 22:38,"Storing Nuclear Waste for 100,000 years is pretty unfeasible too, considering the oldest language on our planet is only about [5,000 years old](http://linguistlist.org/ask-ling/oldest.cfm).  By the time we finally decide nuclear energy is a bad idea, we will have [hundreds of thousands of poison sites to keep track of and keep contained](http://en.wikipedia.org/wiki/List_of_nuclear_reactors).",NEG
883,u/DonManuel,RenewableEnergy,0.8333331346511841,2011-03-24 04:09,Let me predict: windfarms will survive fossil and nuclear energy transformation worldwide in a few decades ;),NEU
928,u/DV1312,RenewableEnergy,0.5639131665229797,2011-03-26 10:58,"Well the easiest way would be to pass a law outbanning nuclear energy instead of a contract with the big four to phase out the plants.

If SPD/Grüne (or the other way around) come back into power they should learn from their past mistakes.",NEG
933,u/DV1312,RenewableEnergy,0.86209636926651,2011-03-26 11:22,Five months ago the opposition against nuclear energy was around 50% - that's almost 25 years after Chernobyl. Now it's 70% or 80%. Unless we magically find a final deposit site nobody will forget about this.,NEU
934,u/farox,RenewableEnergy,0.762039303779602,2011-03-26 11:28,We should bet  :) 1 Month of Reddit Gold that in a year the opposition against Nuclear energy is below 60%.,NEU
1031,u/JarJizzles,RenewableEnergy,0.693878710269928,2011-04-04 07:04,But I have a lot of money invested in promoting nuclear energy and stand to make a fortune from the building of new plants!,NEU
1037,u/VicinSea,RenewableEnergy,0.9610718488693237,2011-04-04 07:43,"We have no idea how many people will be killed by nuclear energy *in the future*. The waste is toxic for 100,000 years, so today's ""safe"" storage may be tomorrow's ""Forest of Silent Death"" &amp; ""River of Agony"". ",NEG
1043,u/ultraayla,RenewableEnergy,0.777066171169281,2011-04-04 08:31,"I'm not a nuclear energy expert, but my understanding is that due to the complexity of the systems, designing a plant and getting it certified is incredibly time consuming (about a decade). I think the amount of money required to finance the reactor also factors in, but I'm not sure how much. Someone else may be able to elaborate, but it takes quite a long time to get even one reactor online. Renewables certainly have their own difficulties coming online, but I think that as part of the package of issues with nuclear, the time to come online is pretty significant.",NEU
1077,u/ikeaslave,RenewableEnergy,0.6752999424934387,2011-04-05 18:30,"&gt;As Japan addresses the aftermath of the earthquake and tsunami, too much worry, time and effort are having to be spent trying to secure and make safe one facility that provided just 3% of the country's electricity.


That sure does seem like a very small payoff compared to the potential risks involved in nuclear energy.",NEG
1181,u/p1mrx,RenewableEnergy,0.6047864556312561,2011-04-09 17:49,Renewable energy **is** nuclear energy (with the exception of tidal power.),NEU
1182,u/BlueRock,RenewableEnergy,0.6525567173957825,2011-04-09 17:56,"No, it's not. Unless you're just being pedantic and referring to the fact that solar and wind energy originates from the sun which is nuclear-powered. That's just confusing and pointless. Nuclear energy refers to terrestrial-based nuclear fission.",NEG
1409,u/discontinuuity,RenewableEnergy,0.6209669709205627,2011-04-23 18:41,"It's a shame that people have been turned off to nuclear power since the disaster in Japan.  Don't get me wrong, I think wind energy is a great idea, but I think that we should really put more research into sustainable nuclear energy like LFTR.",NEG
1502,u/jimofwales,RenewableEnergy,0.7227582931518555,2011-04-30 13:53,I work in renewable energy and fully support nuclear energy. I think we need both especially when we start replacing the heavy lifting done by petroleum and natural gas. ,POS
1511,u/NumeriusNegidius,RenewableEnergy,0.8355525135993958,2011-04-30 17:10,"I see your argument every now and then: ""why criticizing nuclear energy when you should be criticizing fossil fuel"". I want both gone. It's not a nuclear vs fossil issue, it is an issue of old vs new.

It's not an easy task, but it's worthwhile. Don't just take the easy way out.",NEG
1512,u/Zanesan,RenewableEnergy,0.5529115200042725,2011-04-30 17:25,"I must admit that I am not familiar with the nitty gritty, and based my comment on the fact that those who will pursue profit wherever they can have largely ignored nuclear energy.  As far as I am aware, the cost of insurance and the cost of waste disposal are what principally prevent them from being profitable.  Couple that with an enormous up front investment, and there are just better placed for investors money to go.",NEG
1514,u/godwinslawinaction,RenewableEnergy,0.7024824023246765,2011-04-30 18:29,"I agree with nearly all of your points. I just think if we're going to invest in nuclear energy it should go exclusively toward developing future technologies (i.e. thorium reactors, which from what I've heard wouldn't run into scarcity issues at any point in the foreseeable future) rather than building more of the tremendous money sinks that exist today -- especially as long as we don't have a permanent and secure storage solution for the waste.",NEU
1544,u/BlueRock,RenewableEnergy,0.6154729723930359,2011-05-01 09:41,"Sadly, the government south of Hadrian's Wall does not understand this. Or, maybe they do understand it but still prefer the massive transfer of wealth that nuclear energy offers....

P.S. I thought [this comment at the Guardian](http://www.guardian.co.uk/discussion/comment-permalink/10508889) offers an excellent response to those who claim wind turbines ""destroy the countryside"".",NEU
1548,u/discontinuuity,RenewableEnergy,0.6841568946838379,2011-05-01 11:38,"Socialist?  Let's leave politics out of this.  If you mean that it doesn't fit the short-term profit, capitalist business model, then yes you're right.

Government research doesn't just benefit nuclear energy.  Think of the National Renewable Energy Lab (a government-funded institution) or the thousands of state universities researching renewable energy in all forms.",NEU
1908,u/DonManuel,RenewableEnergy,0.9889634847640991,2011-05-26 08:49,"Yes, and thanks for resubmitting here! As the keyword ""France"" is so much associated with nuclear energy I enjoyed submitting it to r/energy first :)",POS
1936,u/DonManuel,RenewableEnergy,0.9591562747955322,2011-05-28 04:46,"We were even more stupid I think, fossil and nuclear energy are anything but cheap if you calculate all costs. And they are finite: just using them up for energy is a big waste at the cost of future generations which might have a better use for it than just burning it.",NEG
1940,u/-Tack,RenewableEnergy,0.6675828695297241,2011-05-28 20:01,Good point about future uses of fossil fuels and nuclear energy. There could be uses we haven't thought of and we needlessly burn them like a hunter burning a forest to get animals to run out.,NEU
2060,u/VicinSea,RenewableEnergy,0.8411347270011902,2011-06-06 21:33,"Good!

I live in downwind of Fukushima...I have enough Nuclear energy to last me the *rest* of my life.",POS
3074,u/cannex,RenewableEnergy,0.792875349521637,2011-09-05 11:34,"""Fossil fuels and nuclear energy have very deep pockets. They can flood the zone with inaccuracies and spread doubt about the ability of renewable energy to do the job. They can hire armies of lobbyists and make hefty campaign contributions. They can enlist the aid of their buddies in other industries.""
This made me laught and cry a little bit!

",NEG
3371,u/InactiveUser,RenewableEnergy,0.9550771713256836,2011-09-22 10:11,"&gt;Costs for Nuclear Energy Skyrocket While Cost of Renewables Plummet

I am so disappointed. I was looking forward to some wealthy suburb getting its own nuclear plant...

&gt;“The hype around a nuclear power revival or renaissance was based on nothing and is effectively dead.”

But wind and solar are apparently myths according to American Republicans. 

&gt;Equally important is that corporate shareholders of large utility companies can do very well financially on such projects when governments guarantee to cover any losses.

But I thought they were profitable and ""too cheap to meter"" ;-9",NEG
4023,u/hjras,RenewableEnergy,0.9544937014579773,2011-11-13 06:38,"The problem is our government has just disabled all subsidies and contracts regarding renewable energy, and is probably pushing for nuclear energy.

That said, they are still trying to build even MORE dams, which in turn is increasing the speed of the erosion of our coast, given that the amount of sand required for the natural replacement in the beaches isn't enough.",NEG
4902,u/alllie,RenewableEnergy,0.6069126129150391,2012-01-13 15:35,"Right. Perfectly safe. Like they always tell us that nuclear energy is. 

I'm past believing them. ",NEG
4910,u/Killington301,RenewableEnergy,0.8601846694946289,2012-01-14 23:31,LFTR is NOT being pushed by the nuclear industry. It doesn't make sense for them to because all the suppliers of the nuclear energy make their money supplying the pellets used in hard and soft water reactors. Honestly your blathering opposition to this idea when it appears you haven't even seen the video is questionable.,NEG
6266,u/piklwikl,RenewableEnergy,0.6075217723846436,2012-06-04 12:13,"The nuclear lobby keeps teling us we must have nuclear -- but this is clearly not true...... Germany shows us that renewables are all that we need.

[10 Reasons Not to Invest in Nuclear Energy](http://www.americanprogress.org/issues/2008/07/nuclear_energy.html)

Nuclear takes huge investment that is better to spend on renewables now.",NEG
7398,u/carlog234,RenewableEnergy,0.6614037752151489,2012-09-24 18:44,"ah i see. how efficient are they these days btw? last i remember (years ago) about 10%? and do you know if the US government is taking steps in this direction or investing in other renewable energy sources?

i personally am a big fan of nuclear energy. especially once we get fusion down.",POS
7788,u/ShieldAre,RenewableEnergy,0.7256944179534912,2012-10-24 07:42,"This is why I think that Germany should keep its nuclear plants running. After all, the risk of a disaster is very small and although the waste is problematic, we will find good ways to deal with it. 

Without nuclear energy, Germany has to either rely more on fossil energy, imported energy or seriously strain its economy in an attempt to turn to renewables.

With nuclear energy, Germany can phase out more fossil energy while concentrating on renewables and then starting slowly to phase out nuclear. The risks and environmental harm are much smaller.",NEU
8437,u/austenite,RenewableEnergy,0.6790862083435059,2012-12-11 14:11,Pretty sure he said he's not very supportive of nuclear energy just not against it.  He also made the comment it's clean in terms of emissions.  I don't see anything there where he states he's not concerned with radioactive waste or that he states nuclear is a renewable energy source.,NEU
8879,u/VicinSea,RenewableEnergy,0.683215856552124,2013-01-06 22:57,"You can buy a perfectly clean lot just outside Hanford, very cheaply. Move your family there and report to us how clean nuclear energy really is.  You have a choice, to buy or not. Most of the people in the area did not have that choice.",NEU
8884,u/Foxkilt,RenewableEnergy,0.9009724855422974,2013-01-07 03:45,"Hanford is about nuclear weapons, which have not much to do with nuclear energy.",NEU
10539,u/InterGalacticMedium,RenewableEnergy,0.6150850653648376,2013-04-15 15:31,"Compare the economic, environmental, climactic and human cost of nuclear energy though and it does quite well compared to many other energy sources such as fossil fuels of every kind and some environmentally damaging renewables.",NEU
10925,u/dlopoel,RenewableEnergy,0.8467158675193787,2013-05-05 09:46,"It's a matter of time scales and and frame of reference. Wind and solar energy are renewable because regardless of if we use or not their energy now there will be some energy left tomorrow (seen from our subjective time scale). This is not the case with modern nuclear energy, which is in limited supply (again with regards to our subjective time scale). If you come up with some imaginary fuel based technologies that would offer million of years of supply I guess that they would fit the definition. ",NEU
10941,u/dlopoel,RenewableEnergy,0.6665410995483398,2013-05-05 11:41,"Sure, we can imagine all kind of scenarios. Doesn't change my point though: modern nuclear energy is not renewable.",NEG
14155,u/Calimhero,RenewableEnergy,0.5400024652481079,2013-11-07 12:50,"I have worked in nuclear safety and consider myself a mild supporter of atomic energy. This is correct, nuclear energy is outrageously expensive. There is absolutely no denying it.",NEU
14491,u/absolutebeginners,RenewableEnergy,0.9301429986953735,2013-11-22 11:52,"We spend quite a bit on energy research. From 2003-2012 DOE spent approximately $29 billion on research of Renewable Energy, Energy Efficiency, Nuclear Energy, and Electric Systems with about 10 billion on fossil energy.",NEU
14548,u/ferdinand,RenewableEnergy,0.7094627618789673,2013-11-29 07:49,"&gt;we spent $14 billion subsidizing renewable energies in 2010 -- $16.5 billion if you count nuclear energy.

Why would you count nuclear energy as renewable?",NEU
17188,u/wurftz,RenewableEnergy,0.9825631976127625,2014-04-16 02:14,"Fuck nuclear energy.
How can it ever be considered renewable?

Why did you even bother posting this?",NEG
17226,u/spiralout154,RenewableEnergy,0.912563145160675,2014-04-16 21:50,The circle jerk of attacking nuclear energy on this sub is horrendous. I just subscribed earlier today and already I'm unsubscribing. Being in favor of one form of energy doesn't mean others are bad. There is no single right answer and the future will require a collection of multiple energy sources. ,NEG
18694,u/DonTheWolf212,RenewableEnergy,0.719504177570343,2014-06-06 20:09,"I dont trust it completely yet, but with all things it just takes research and time. I'm all for the research and responsible handling of nuclear energy, the industry just hasnt shown me what I want to see as far as standards go. In the future I have no doubt that nuclear will replace most forms of energy, and far surpass them in safety and efficiency. ",NEU
18704,u/WiseCynic,RenewableEnergy,0.5892468094825745,2014-06-06 22:07,"The subreddit is ""Renewable Energy"", not Nuclear Energy or CO2-free energy, or something else related to nuclear energy.

There are other subreddits for that.

&gt; I never said it was renewable

RENEWABLE energy does not include nuclear.  For Odin's sake, read the goddamn sidebar!
",NEG
20637,u/Isek,RenewableEnergy,0.9601166248321533,2014-10-04 14:26,"Bullshit. Getting rid of nuclear energy was already decided on in 2000:

http://de.wikipedia.org/wiki/Atomkonsens
http://news.bbc.co.uk/2/hi/europe/791597.stm
",NEG
21934,u/paulwesterberg,RenewableEnergy,0.6843814849853516,2014-12-28 17:15,At high cost and poor efficiency. Worth it if you have logistics problems and excess nuclear energy power generation. Not so worth it for people looking for an alternative to gasoline.,NEG
22882,u/bisnicks,RenewableEnergy,0.42845743894577026,2015-03-11 06:41,This drives me insane. Nuclear technology of today is nothing like that of yesterday. Nuclear energy holds a lot of promise and could ease our dependence on fossil fuels while also being much better for the environment.,NEU
23804,u/biledemon85,RenewableEnergy,0.5151992440223694,2015-05-21 09:55,"Indeed I think you are correct.  
&gt;[Over 40% of the current MIT Physics Department faculty supervising more than 90 graduate students conduct their research in LNS.](http://web.mit.edu/lns/research/)

Edit: Well shit, no that's particle physics. My bad ;P  
Edit 2: [Here's their nuclear energy department](http://web.mit.edu/nse/index.html).",NEU
24171,u/DonManuel,RenewableEnergy,0.8864046931266785,2015-06-26 06:42,"They write the term ""renewable energy"" but that sounds strange. It was Gates who smeared renewable energy when investing in Gen IV nuclear energy. Again, with no word any technology is explicitly named, so I think this is just a promotion of greenwashed Gates nuclear. ",NEG
25472,u/iamiskander,RenewableEnergy,0.8906417489051819,2015-10-26 11:06,"I always wondered why the US didn't just tell Iran to do this vs helping them go nuclear. I'm not one of those crackpots who think the deal is going to end the world... but if a country like Iran having nuclear energy is ***that dangerous*** why not help them do something like this? Clean energy and no bombs.

I bet everyone involved spent more money on jet fuel flying there to argue about uranium enrichment in a 5 star hotel then it would have cost to solve the problem!",NEG
25822,u/renewablebiofuels,RenewableEnergy,0.6236464381217957,2015-12-07 01:10,"Probably it means this :Cestas will see its solar energy for a price of €105/MWh ($111/MWh) for 20 years, which is on a par with wind power and cheaper than the cost of new nuclear energy, confirmed Neoen chief executive, Xavier Barbaro.",NEU
26666,u/cricrithezar,RenewableEnergy,0.802222490310669,2016-01-30 09:07,"Even though renewables are definitely better in the long run, I'm pretty sure nuclear energy is one of the cheapest energy sources out there. I still think fission is still better than fossils, and ~~remembers~~ renewables (stupid auto-correct) are way better than any other known energy source apart, probably, from the still untamed fusion energy. But nuclear is still a step forward in my eyes.  
EDIT: fought the auto-correct and won.",POS
26669,u/Koala_eiO,RenewableEnergy,0.5352444052696228,2016-01-30 15:09,"&gt; I'm pretty sure nuclear energy is one of the cheapest energy sources out there.

The issue is that nuclear energy price doesn't take dismantling costs into consideration.",NEU
26670,u/nebulousmenace,RenewableEnergy,0.8315727114677429,2016-01-30 18:34,"&gt;I'm pretty sure nuclear energy is one of the cheapest energy sources out there.

Are these the theoretical prices to build the next few nuclear reactors or the actual prices where so many of them end up? ",NEU
27032,u/VLXS,RenewableEnergy,0.7685037851333618,2016-03-08 04:14,"Both Buffett and Gates are way too invested in Nuclear power to support renewables now. 

They must have gambled millions on Nuclear energy generation and now they're losing sleep over it. Reddit is full of pro-nuclear shills that pop out of the blue on most high-visibility renewables threads and this is frequently seen in Bill Gates related articles.",NEG
27147,u/RakeshCristoval,RenewableEnergy,0.7294982671737671,2016-03-18 15:33,"What those cities should be fighting for is the shutdown of coal power plants. Nuclear power plants should be closed but only in the long run. I think we need nuclear energy to stick around a little longer until most of the electricity generated comes from renewable sources. As it is, nuclear energy emits no carbon dioxide, so if it stuck around a little longer, climate change would be easier to eliminate. ",NEU
27410,u/misyo,RenewableEnergy,0.6407431960105896,2016-04-12 15:37,I'm not discussing the article. I'm addressing concerns about long term investment in nuclear energy with someone who seems keen to do so as a bridging method of energy production between oil and renewables. Unless I read your position wrong in your other responses.,NEU
27480,u/4ray,RenewableEnergy,0.7460347414016724,2016-04-19 21:44,Making nuclear energy the universal source.,NEU
27656,u/phantuba,RenewableEnergy,0.7909623384475708,2016-05-08 15:15,"So what's wrong with nuclear energy? I get this sub is /r/renewableenergy, but shouldn't we be supporting *clean* energy too? ",NEU
27675,u/relevant_rhino,RenewableEnergy,0.7676702737808228,2016-05-09 07:20,"* Too expensive.
https://www.youtube.com/watch?v=E5lg73SDYUw
If there was a save and cheap form of nuclear energy i would support it. In real live it looks like it is still a dream.

* +- 400 Reactor's running on the Planet. Not a single end storage for the waste.

* Renewables are already cheaper than new Nuclear, so why should we put money in it?",NEG
28786,u/5baserush,RenewableEnergy,0.9665012955665588,2016-08-26 06:34,Nuclear energy is green energy! What a crappy title.,NEG
29319,u/Macscroge,RenewableEnergy,0.570101797580719,2016-10-06 13:26,Why is nuclear energy so often portrayed as an antagonist against renewables in this sub? ,NEU
29330,u/Dontblinkdoc,RenewableEnergy,0.8672229647636414,2016-10-06 16:15,"I think it comes down to aiming to be sustainable, nuclear energy presents a problem that renewables do not. The problem of how do we sustainably and reliably keep nuclear waste from being harmful to people or to our environment makes it a far more dangerous form of energy than harnessing the energy from the sun or wind. Containers break, reactors melt down, just like oil pipelines burst. That's why I think nuclear is antithetical to renewables. ",NEG
29339,u/larlin289,RenewableEnergy,0.7096269130706787,2016-10-06 23:28,For me it mostly comes down to being the same money. Money is either spent on nuclear energy that at best will produce energy in 10 years. Or it is spent on renewables that will produce in 2-3 years. So any money spent on nuclear is more or less wasted from a perspective of renewables.,NEU
29404,u/lyndy650,RenewableEnergy,0.7939242124557495,2016-10-09 17:16,"If not comparing renewables vs nuclear. I'm saying we're in a transitional phase as far as electrical generation goes, and we need to get rid of coal and natural gas generation in order to cut down on emissions. While we work on the engineering behind energy storage, continuing to use nuclear energy is our cleanest and safest bet. The enemy here is fossil fuel generation, not nuclear fission generation.
",NEU
29718,u/This_Is_The_End,RenewableEnergy,0.8853081464767456,2016-10-21 03:06,"No, these type of posters aren't able to see the usage of a working European grid. Of course Germany is able to import power and vice versa. The renewable are a real problem for the grid, because Germany is exporting massive power at peak times which renders these huge power plants less profitable. Power from nuclear energy and natural gas are suffering from this effect. ",NEG
32035,u/deck_hand,RenewableEnergy,0.7576594948768616,2017-01-13 09:41,I thought that a large part of the cost of fission plants was related to the radiation and safety factors that have to go into protecting and transporting the fuel and the spent fuel.  Is that not so?  Is 72% of the cost of nuclear energy just operating and maintaining the steam generator?,NEU
32666,u/dgusain,RenewableEnergy,0.5495561361312866,2017-02-01 04:44,"The only way we are going to have any sort of control back in climate fight is with the use of Nuclear Energy. Wind, Solar etc are all good, but Nuclear is the solid deal. ",NEU
33093,u/obtk,RenewableEnergy,0.6710289716720581,2017-02-18 11:06,"Nuclear fission is the primary nuclear energy source, and that is the destruction of atoms, which there are limits of in the world, so by definition it's non-renewable. I don't know much about nuclear fusion, but I believe that it would be classified as renewable.

Nuclear energy definitely is greener than fossil fuels, with the only real issue being the nuclear waste, which can be disposed of safely and greenly.",NEU
33095,u/DonManuel,RenewableEnergy,0.9692089557647705,2017-02-18 11:34,Nuclear energy consumes finite mined resources to run and leaves terribly hazardous waste. Has no place on this sub.,NEG
36034,u/noahio,RenewableEnergy,0.7112833261489868,2017-06-24 07:40,"What does windows 95 have to do with the iPhone? And more importantly, what do either of them have to do with nuclear energy?",NEG
36993,u/Bigi345,RenewableEnergy,0.9187694191932678,2017-08-02 19:11,"Just like what the bot said, i do think it seems a bit too late. Unfortunately the general population isn't exactly embracing nuclear energy",NEG
37310,u/neprofil,RenewableEnergy,0.6383267641067505,2017-08-16 10:22,"So if these deaths are prevented by avoiding the use of coal, that means that the equivalent amount of nuclear energy also saves 12,700 people per year then?",NEU
