,author,subreddit,score,created,body,label
74925,u/dabderax,RenewableEnergy,0.8990613222122192,2020-12-08 15:40,I'm pro nuclear energy but this just looks stupid. you do cost-benefit analysis (near or long) and adjust your laws and incentives based on it.,NEG
75457,u/rexvansexron,RenewableEnergy,0.8144915103912354,2020-12-16 23:37,"the economics are in the wrong business model of today. 

nobody accounts in any fossil fuel price for the environmental cost it will produces through its use. 
thats why green tech is not competible. 

the same is with nuclear energy. when accounting for long term storage of their waste products, nuclear energy looses its cheapeness. 

but we have to account for this. 
the whole world is built on an incomplete view of economics. thats would be a major driver for a sustainable earth if this gets corrected. 

the optimum would be coming to a resource based economy.",NEG
76410,u/[deleted],RenewableEnergy,0.9324395060539246,2020-12-31 14:44,Nuclear energy is not renewable energy.,NEG
76448,u/notapantsday,RenewableEnergy,0.8523814678192139,2021-01-01 04:21,"I'm really not a fan of nuclear energy, but coal should have been first.",NEG
76572,u/Interesting-Current,RenewableEnergy,0.4971308708190918,2021-01-02 01:31,"Nuclear energy was an ok substitute for fossil fuels 30 years ago, but it seems crazy that reddit seems to support expanding nuclear today. Great post",POS
76583,u/solar-cabin,RenewableEnergy,0.8893524408340454,2021-01-02 02:40,"I see you are a nuclear energy supporter.

Nuclear energy is not renewable energy.

Rule 6- No whitewashing of Nuclear or Fossil Power",NEG
76590,u/solar-cabin,RenewableEnergy,0.9025605320930481,2021-01-02 03:11,"Nuclear energy is not renewable energy.

Rule 6- no whitewashing nuclear or fossil energy",NEG
76792,u/theBAANman,RenewableEnergy,0.9648997783660889,2021-01-05 14:32,"This is not a point against nuclear energy, but it is proof that people in this sub have no idea what they're talking about. You guys have a fundamental misunderstanding of how nuclear energy is currently produced **and** what led to those disasters.

It's unfortunate that the main sub for renewable energy is being restricted by lite pseudoscience on the mods' part.",NEG
76815,u/HangScump,RenewableEnergy,0.9465604424476624,2021-01-05 17:23,Haha your whole post here is illogical being in a solar forum. I'm the one using rational thought. You're the one who's biased specifically for nuclear energy which is the stupidest energy yet so yeah bye bye.,NEG
76894,u/solar-cabin,RenewableEnergy,0.8152067065238953,2021-01-07 07:11,"When you start with ""dude"" and you post this:

""You ""I think it wouldn't have been a too bad idea to have the last nuclear plants in Germany run a few more years""

It makes me question anything you are saying but regardless as you have been shown it is Germany's old grid infrastructure. inefficient homes and using diesel trucks that has slowed down progress on renewable energy.

If that is your government then address those issues instead of soft selling nuclear on a renewable energy sub, please. Nuclear energy is not clean or renewable energy.",NEG
76915,u/Stranfort,RenewableEnergy,0.5718995928764343,2021-01-07 20:00,"You’re right. I hate to admit it but you’re right. I was researching it a little and it seems their not profitable anywhere in the world. And solar is in fact more profitable. 

But I would still encourage research into nuclear energy to find a solution to the shortfall. Because it generates so much more electricity than any other source of energy. Because they have the highest capacity factor. 

Nuclear energy has so much incredible potential we just have to find a way to make it profitable and more affordable.",NEU
76917,u/Stranfort,RenewableEnergy,0.49085599184036255,2021-01-07 20:40,"I was a big fan of nuclear and still am. But by the course we are going. I guess I’ll never get to see a golden age of nuclear energy. Solar and wind will most likely overtake nuclear as they get more advanced over time along with its virtually limitless supply of power. Solar panels will only continue to expodetisly improve the level of light absorption. At least geothermal will get some credit. I love geothermal energy. A close second. But in either case, 

You win.",NEU
76961,u/Interesting-Current,RenewableEnergy,0.9156002998352051,2021-01-08 23:58,"In Australia we have a nuclear energy ban, but recently fossil fuel lobbying have been ""supporting"" nuclear as a way to delay the switch to renewables those are the real threats for them",NEG
77356,u/solar-cabin,RenewableEnergy,0.852136492729187,2021-01-16 13:21,Nuclear energy would still be much more expensive than renewable energy and it would still rely on a finite material we will run out of.,NEG
77364,u/Interesting-Current,RenewableEnergy,0.5023964643478394,2021-01-16 15:22,Reddit has a huge nuclear energy hivemind,NEU
77378,u/NinjaKoala,RenewableEnergy,0.834276020526886,2021-01-16 19:34,"&gt;If that were true, China wouldn't be massively expanding nuclear energy while the West turns away. 

In 2019, China got 4.9% of its grid energy from nuclear power. Their current plans call for it to generate 7.7% of their grid energy by 2030.  


The U.S. gets roughly 20% of its electricity from nuclear power. Tell me again how the Chinese program is ""massive.""",NEU
77387,u/solar-cabin,RenewableEnergy,0.5842031240463257,2021-01-16 21:15,"The reality is nuclear energy is not clean, cheap, fast to build or renewable.

It will be decommissioned and phased out as more renewable energy with storage capacity comes online and is already happening around the world.

Have a great night!",NEU
78950,u/blacx,RenewableEnergy,0.9566923975944519,2021-02-13 23:40,"dude, read the shit you post at least
&gt;Is nuclear energy renewable? No, but it is considered sustainable.

And now read the title of this sub",NEG
79179,u/gpearce52,RenewableEnergy,0.771648108959198,2021-02-17 10:21,"An official with the Electric Reliability Council of Texas said Tuesday afternoon that 16 gigawatts of renewable energy generation, mostly wind generation, were offline. Nearly double that, 30 gigawatts, had been lost from thermal sources, which includes gas, coal and nuclear energy.

https://www.texastribune.org/2021/02/16/texas-wind-turbines-frozen/amp/",NEU
79573,u/Material_Homework_86,RenewableEnergy,0.7831581830978394,2021-02-22 13:22,"Encourag local regional power based on solar, wind, availability of small hydro, geothermal,  biomass to supply close to home needs. Investments in efficiency storage reduce needs for any fuels. Storage batteries near loads then expand hydrogen production when. Excess renewable energy produces incredible amounts of storable transportable fuel to replace natural gas, other fossil fuel and nuclear energy.  Using existing transportation, storage, equipment,  generation investments green hydrogen is ideal for green energy future.",POS
80983,u/-kekevi-,RenewableEnergy,0.6955792903900146,2021-03-18 13:28,I hope it will be economical to build batteries for arbitraging soon. Without nuclear energy we probably need to build a lot of them and they need more income sources than frequency control as it is a very limited requirement for grid (I am talking about FCR; the others are still not feasible for batteries),NEU
81708,u/doshea213,RenewableEnergy,0.8624542951583862,2021-04-05 17:27," Once those batteries become obsolete, there needs to be better ways to recycle the chemicals in the batteries so that we do not end up with a similar situation to Nuclear energy, where we are just storing incredibly hazardous material in caves for eternity.",NEG
81709,u/doshea213,RenewableEnergy,0.7548800110816956,2021-04-05 17:51,Do any of you see issue with Nuclear energy being an extremely dirty energy source due to the fact that the waste product will essentially be with us indefinitely?,NEG
81734,u/daughternature00,RenewableEnergy,0.8032053112983704,2021-04-06 18:28,"Nuclear power is also viewed as dangerous by some, the Fukushima disaster and 3 mile island still cause some to believe it is not safe. Some advancements have been made in safety, as well as processes that use the secondary product of nuclear energy, cesium 137. Nuclear would provide a solid baseload to compliment solar but people don't see it as being at the same level of other renewables",NEU
83966,u/SomeoneToLienOn,RenewableEnergy,0.9788955450057983,2021-05-23 09:35,It’s unfortunate nuclear energy makes you so childish. You’re not doing your side any favours.,NEG
84863,u/thorium43,RenewableEnergy,0.5487729907035828,2021-06-08 17:07,"Kate Brown at MIT has a good book on Chernobyl and the systemic misrepresentation of health effects by authorities.

The World Nuclear Industry Status Report is good for the status of the nuclear energy industry. 

The problem is the hippies that oppose nuclear on non scientific grounds so there is a lot out there that is not rigorous at all, and you have to dig deeper to get the real good info on why the industry is struggling.",NEU
85714,u/just_one_last_thing,RenewableEnergy,0.6559320688247681,2021-06-21 19:33,"&gt; The package aims to boost nuclear energy, hydrogen energy and carbon capture, which uses developing technology to capture emissions from activities such as burning fossil fuels. 

The holy trifecta of performative centrism technology.",NEU
85734,u/pearlsandplumes,RenewableEnergy,0.7675760388374329,2021-06-22 07:27,"&gt;The package aims to boost nuclear energy, hydrogen energy and carbon capture, which uses developing technology to capture emissions from activities such as burning fossil fuels. 

Except for *maybe* green hydrogen, this is money directly down the drain. But what else is new.",NEU
89105,u/GiveMeSumKred,RenewableEnergy,0.5543733835220337,2021-08-24 05:34,"Obviously, nuclear has proven safer than some may have feared in the 1970s, but nuclear energy is not clean energy. I’ve worked Yucca Mountain. Some day it will be full. Further, you have to mine uranium. It’s hard to talk about that in clean terms. It makes sense to use nuclear in transition to true clean energy, but we’ll need something cleaner in the future. Why give up on hydrogen already?",NEU
92446,u/pistacheyo,RenewableEnergy,0.7767627239227295,2021-10-26 01:58,"Commenting so I can follow this post. 

I have worked in Solar, Wind, and now Nuclear energy.",NEU
92456,u/AtomicEnthusiast,RenewableEnergy,0.7453380227088928,2021-10-26 03:55,"I think the main factor would be the inherent association between nuclear energy and nuclear weapons, especially when considering that the latter was among the first applications of nuclear fission. Well known Nuclear accidents have also contributed to this perveption. 

A lack of understanding of these things ultimately mean that a layman is unable to understand to truly understand the distinction between nuclear weapons and nuclear energy",NEG
94829,u/Tafinho,RenewableEnergy,0.7963173985481262,2021-12-04 06:32,"New nuclear generation costs around 140€/MWh if used for base load (assured market placement at guaranteed prices) . If sold at markets prices, nuclear energy is nowhere near economically effective.

Check the Hinckley Point C drama.",NEG
95136,u/Willing-Ad55,RenewableEnergy,0.9517949819564819,2021-12-10 04:41,"Nuclear energy is the energy in the nucleus, or core, of an atom. ... The fuel that nuclear reactors use to produce nuclear fission is pellets of the element uranium. In a nuclear reactor, atoms of uranium are forced to break apart. As they split, the atoms release tiny particles called fission products.",NEU
95296,u/CorDeGeleia,RenewableEnergy,0.8504278063774109,2021-12-13 07:44,"I'm genuinely curious. Sources because I don't want ""fantasy"" idealistic opinions, Im considering whether we truly have an alternative to fossil fuels on our global energy demand.   
I'm a biologist but I don't understand much about physics, but I often hear from colleagues that energy from wind farms aren't exactly sustainable, that nuclear energy is apparently clean despite all the risks involved... and I wanted to hear the opinion of people who have actually studied this.",NEU
95764,u/Leftstone2,RenewableEnergy,0.8189466595649719,2021-12-20 08:06,"While nuclear energy isn't necessarily ""renewable"", it is carbon free and does fill a lot of use cases that renewables can't. Maybe you can argue that discussions about it don't belong in this sub but if we're pursuing a carbon free future, discussions about nuclear are necessary.",NEU
96017,u/ButterflyCamo,RenewableEnergy,0.49340805411338806,2021-12-23 13:28,"How about a big yeah.

You gotta go with facts and science.
And science supports nuclear energy far more than these other pathetic alternatives.",NEG
96027,u/Interesting-Current,RenewableEnergy,0.9676730036735535,2021-12-23 19:36,"Nuclear energy kills more birds per kwh than wind

And in addition to that it is unrenewable, creates nuclear waste, has potential for catastrophe, extremely high water consumption, slow to build, hard to turn off quickly, etc",NEG
97101,u/davypbc,RenewableEnergy,0.775149405002594,2022-01-17 13:27,"It seems like the main argument against green hydrogen is that electrolysis is energy intensive, but with the continued build out of renewables and nuclear energy costs fall and green hydrogen becomes a lot cheaper energy storage than batteries",NEU
97951,u/RahulTheCoder,RenewableEnergy,0.8488796353340149,2022-02-04 07:08,"Me too..  i also wanted to study the renewable energy sources, the process and the mechanics behind it.  


For now I selected 2 books

One is :  Solar Energy: The physics and engineering of Photovoltaic conversion technology and systems.

I just started it. As per topics and preface the book explains the solar radiation, photo voltic cells and systems.


2nd :  Nuclear Energy: an introduction to concepts systems and applications by
Raymond L. Murray",NEU
98795,u/cury41,RenewableEnergy,0.6028788089752197,2022-02-22 23:55,"Don't have a source for you sorry.

But for me the reason nuclear energy shouldnt count as renewable is in the definition of the word renewable. The word renewable implies that there is an infinite source that can be reused. Nuclear energy however requires fuel from a non-renewable feedstock.

Also, pretty weird you have to do an essay on why it should not count.",NEG
98967,u/M1ngb4gu,RenewableEnergy,0.9490607976913452,2022-02-25 02:39,You know geothermal is nuclear energy right?,NEU
98970,u/rexvansexron,RenewableEnergy,0.733500063419342,2022-02-25 03:19,"not entirely. 
and calling it nuclear energy in that context is just wrong. 

fossil fuel is also renewable when speaking of millions of years since fossil fuel is just converted sunlight and biogenic matter.",NEG
98980,u/M1ngb4gu,RenewableEnergy,0.904148280620575,2022-02-25 05:37,"Mostly though.

Yeah, and nuclear energy is renewable in that there is enough fissionable material on the planet that we realistically will never run out.",POS
99034,u/CORedhawk,RenewableEnergy,0.8547215461730957,2022-02-26 11:15,I believe every country should try to be as energy independent as possible.  For Europe I hope that they reconsider how nuclear energy fits into their mix. (and maybe the rest of the world too),NEU
100572,u/oldpricklybastard,RenewableEnergy,0.7930593490600586,2022-04-01 10:30,No not trolling.  I believe in renewable  nuclear energy. I do believe climate change is definitely a problem. My point still  is it's going to take all countries on the same page or at least the same chapter.,NEU
102353,u/reddit455,RenewableEnergy,0.6914064288139343,2022-05-19 14:45,"&amp;#x200B;

&gt;Please indicate your stance on using nuclear energy as a energy source in your country

&amp;#x200B;

regarding the old crappy reactors that are causing all the problems..  or the newer designs?

&amp;#x200B;

without ***context*** it's impossible to determine my stance.",NEG
103722,u/Dolphin-Uprising,RenewableEnergy,0.9345128536224365,2022-06-20 13:01,"What would have been the outcome in India if the clean energy was utilized for residential only instead of sharing the generated solar power with industrial infrastructure, I wonder? What about nuclear energy, and why is it not part of the discussion?",NEU
104214,u/FactHunt69420,RenewableEnergy,0.8717972040176392,2022-06-27 16:57,"Hey mate,

Glad to see an Aussie looking into the nuclear energy topic, its so taboo here!

I filled in your survey, I'm pretty pro-nuclear (even did an internship 15yrs ago at a nuclear plant), so I think my opinion might distort your count of what would otherwise be 'general public' opinion. So take my inputs with a grain of salt :)

Cheers",POS
104623,u/darth_-_maul,RenewableEnergy,0.7688347101211548,2022-07-06 13:41,"And nuclear is a low carbon source. The cheep nuclear energy won’t go away because that will raise electricity prices, and the cheep renewables will keep expanding because that will lower electricity prices, getting rid of either would be political suicide. And we could add a CO2 per kilowatt clause to the mega grid.",NEG
104640,u/MegavirusOfDoom,RenewableEnergy,0.8908179402351379,2022-07-07 05:10,"I mean thermal energy from hydrogen for heating and cooking. Very roughly, a new electrolysis plant today delivers energy efficiency of around 80%, compared to the energy input.

If that energy is used for home heating (direct combustion), it's 330kwh per kg, so 75kg of hydrogen in your garden from your pond will keep an average home warm for about 1000 days....

Even if you use crappy electrolysis at home, with 60% efficiency, from wind, the raidiator energy price is still 1/2 price of nuclear energy current grid price.",NEU
106148,u/thestrodeman,RenewableEnergy,0.613387405872345,2022-08-15 17:00,"[https://www.inet.ox.ac.uk/files/energy\_transition\_paper-INET-working-paper.pdf](https://www.inet.ox.ac.uk/files/energy_transition_paper-INET-working-paper.pdf)

&amp;#x200B;

Page 2 has a pretty excellent graph illustrating my point. Nuclear energy underwent exponential growth between 1970 and 1990 worldwide. Costs didn't decrease, they increased. Nuclear doesn't have a favorable learning curve.",NEU
108286,u/Leftstone2,RenewableEnergy,0.8825384974479675,2022-10-07 17:56,Isn't the eu still purchasing fossil fuels from Russia to the tune of billions of euros? I'm not sure why this article is so focused on nuclear energy when they can't even ween themselves off fossil fuels.,NEG
108430,u/glefe,RenewableEnergy,0.7284938097000122,2022-10-12 23:21,"This is what happens when people are idolised beyond their expertise. Nuclear energy is a mess. It is better to lower the living standard of Middle Europe, which is already higher than in many other regions of the world, by reducing energy consumption, especially of fossil industries, than to rely on centralised, expensive, uninsurable, high impact risk-charged means of energy production like nuclear energy.

Yes, coal and natural gas are not the answer, but few even recognise the unsustainable practices that parts of the German economy rely on. Energy has a cost.",NEG
108437,u/Blueberry_Conscious_,RenewableEnergy,0.5591286420822144,2022-10-13 01:36,"Genuine question - where do you find reliable sources to learn about nuclear energy that's not simply shills or industry-sponsored researchers (tall ask in most industries) or anti-nuclear environmental groups. 

To be honest, I don't know much about it, and I think I should learn something.",NEG
108664,u/krakotay1,RenewableEnergy,0.8995102643966675,2022-10-20 14:53,"&gt;Won't change anything regarding nuclear. Those are never insured (no insurance will touch them). The 'insurance' in that case is called: taxpayer. If we were to add the insurance cost to nuclear power the price would be even worse than it already is.

Funny moment that nuclear energy might be good to beat global warming... if it was cheaper, ofc =)",NEG
108728,u/Daddy_Macron,RenewableEnergy,0.8178852200508118,2022-10-24 08:03,"&gt; If we do not invest ik nuclear energy


Nuclear power already receives tens of billions of dollars in R&amp;D subsidies every year. Even long-shots like Nuscale got $1.4 Billion from the Department of Energy and they're still a decade out from building their first commercial reactor.


Meanwhile, global annual production of electricity by Wind and Solar surpassed nuclear power last year. A 10 year buildout surpassed a 60 year one. I know which horse I'm hitching my wagon on.",NEU
109138,u/AnonymousWritings,RenewableEnergy,0.5662108063697815,2022-10-31 20:15,"Lol. No. 

Nuclear energy is fine. It's technologically viable, safe, low emissions. Yada yada. 

And even 10 years ago, it would have made sense to push to build. 

Now though, renewables are so cheap, that it just doesn't make sense. funding nuclear is now an opportunity cost where more decarbonozation could be done faster and cheaper with wind/solar.",NEU
109199,u/joemeatballs11,RenewableEnergy,0.6291678547859192,2022-11-01 11:41,"If people were serious about green energy we'd be investing in nuclear energy. That is the future, not this nonsense",NEG
111249,u/Generallyawkward1,RenewableEnergy,0.6239256262779236,2023-01-10 00:01,"Forgive me for asking, but, what makes nuclear energy a waste of money?",NEG
111804,u/starf05,RenewableEnergy,0.8695951700210571,2023-02-02 07:16,"French nuclear fleet is old and as a consequence, nuclear energy generation has been falling, due to the increased need for maintenance of the nuclear fleet. Less nuclear=you have to produce electricity in other ways.",NEG
112559,u/coconutsack699420,RenewableEnergy,0.5118416547775269,2023-02-28 08:46,"Yes, I do support nuclear energy",NEU
113629,u/DefenderRed,RenewableEnergy,0.826082706451416,2023-04-01 11:19,"Nuclear energy needs to be part of the energy mix/ solution. We don't need anymore of the old huge monolithic nuclear power plants, instead, we need the SMRs and molten salt reactors to be deployed along with solar and wind.

When these coal plants get shut down, it'd be wise for them get repurposed with nuclear, solar, and wind since they already have the supporting grid infrastructure built in.",NEU
114883,u/falconx2809,RenewableEnergy,0.5119621157646179,2023-05-15 11:38,"1) fuel costs represent only a small portion of the total cost of nuclear energy, so withdrawing that subsidy won't have a large impact on the price of nuclear energy
2) out of ~14000 mtoe energy consumption globally, 7500+ mtoe of energy is consumed by countries which possess nuclear weapons ( i e countries which also possess nuclear enrichment capability ), so your assumption that nuclear recycling creates proliferation risk & that it is not suitable for most of the world  does not make much sense",NEU
114890,u/sault18,RenewableEnergy,0.9666873216629028,2023-05-15 12:29,Still don't change the fact that you'll say anything and everything to crap on Renewables and support nuclear energy regardless of the facts. Yawn...,NEG
114926,u/falconx2809,RenewableEnergy,0.8066026568412781,2023-05-15 19:33,"1) the argument of fuel cost is relevant because recycling cost ultimately affects fuel cost, so even if France were to not subsidize nuclear fuel recycling and just pass it on to the energy companies it wouldn't affect the final price of nuclear energy much 
2) did US abandoning nuclear fuel recycling prevent Iran from developing  nuclear capability ? No
Did it prevent Iran from building more centrifuges ? No
Same with NK, countries which want to develop nuclear weapons will develop them no matter what 
3) i do not dismiss the risk of nuclear proliferation, but take a realistic view of things",NEU
115045,u/alien_ghost,RenewableEnergy,0.5267382264137268,2023-05-23 08:36,"What is status quo about building sustainable infrastructure?    
So oil companies should power our society for free? They are providing what we are using. If we as a society had decided to use nuclear energy, we'd be in a different place. But we didn't, so we're not.  
And people are changing the narrative by building sustainable infrastructure. We have already started using less gasoline than before.  What are you doing to build sustainable infrastructure, seeing as it is so important to you that you think you can tell other people what they should do?",NEU
115227,u/silentsnooc,RenewableEnergy,0.5024194121360779,2023-06-02 06:29,"We can do that. But I'd prefer to have an immediate reduction by 50% right now, and a parallel adoption to solar asap instead of shutting down all coal plants today, start WW3 over nuclear energy and not even have to time to convert to solar.

That's, obviously, a lazy dramatic simplification that's not true at all but what I want to say is: It's one thing what we want to do, and it's another thing what we can do.",NEG
116115,u/64sweetsour,RenewableEnergy,0.8205309510231018,2023-08-14 06:41,"To be fair, waiting for nuclear energy is a big part of nuclear energy in general. So at least they stay on message",NEU
116829,u/Recent-Construction6,RenewableEnergy,0.5986757874488831,2023-10-19 21:11,"I think once Nuclear fusion comes about as a viable tech that will solve most of the issues involved with nuclear energy, unfortunately i don't think we can talk about a clean energy future that doesn't involve some form of nuclear energy, simply due to the materials neccessary to make solar panels and wind turbines, etc.",NEU
116835,u/hypercomms2001,RenewableEnergy,0.6702503561973572,2023-10-19 22:21,"The lifetime of a typical renewable source is about 25 years when compare to a nuclear reactor now of 80+ years. In addition because of the extremely high energy density of nuclear energy, once a reactor has been built, it very quickly repays it’s upfront capital investment…. Which is more than three times the return on investment in renewable energy.",NEU
