,author,subreddit,score,created,body,label
37590,u/raptorman556,RenewableEnergy,0.6211305856704712,2017-09-04 18:52,"Although good, it should be pointed out that nuclear energy is not renewable.",NEG
39075,u/waynep712222,RenewableEnergy,0.6775635480880737,2017-11-22 18:10,"oh i wished i had recorded the short speach given by former vice president Dick Cheney about how the american public will need to finance new nuclear energy plants as banks won't finance them as they are only good for 40 years and they don't pay off in the long run so it will be up to the american tax payer to support the building of new nuclear plants. 

 i was laughing my head off at the former CEO of Halliburton . who is one of the approved contractors building nuclear generating plants. ",NEU
39363,u/EsteemedSir,RenewableEnergy,0.5416146516799927,2017-12-09 07:52,"From what I understand, if we were to use breeder reactors we'd have enough fuel for 5 billion years, I'm which case it may as well be renewable, the Earth is only expected to survive another 4.5 billion. Not that that's the only reason, but seriously nuclear energy can only get better the more money we use to research it.",POS
39413,u/Hank_hill_repping,RenewableEnergy,0.9517264366149902,2017-12-11 22:37,"A nuclear plant has never been made on budget in the west.

In terms of clean, nuclear energy is responsible for one of the worst environmental disasters in history. It is not clean by any measure except it is lower in CO2 than fossil.",NEG
39548,u/deck_hand,RenewableEnergy,0.5680966377258301,2017-12-22 06:11,"Nuclear energy is a necessary part of our near future.  Maybe one day we can outgrow the need for them, but not in the near future.",POS
39581,u/deck_hand,RenewableEnergy,0.5776585936546326,2017-12-23 10:47,"We *can* skip it now, but the real question is “why should we?”  I understand that a bunch of people are terrified of nuclear energy, but other than the fears, if done correctly, they can produce clean, abundant energy for decades. 

The real issue is cost. If we can’t do it at a reasonable cost, then it doesn’t help anything.  Like solar roads, an expensive solution that since better than a cheap one is not advancing the cause.

Still, I think we have enough challenges that a diverse mix of energy sources.",NEG
40376,u/av1982,RenewableEnergy,0.96347975730896,2018-01-29 09:16,"This is what I thought. So now when someone says nuclear energy is ""clean"" I'm going to tell them they are full of shit. ",NEG
40685,u/mandathor,RenewableEnergy,0.6206302046775818,2018-02-11 11:29,"Not sure what you'r getting at.  But the idea is just that with radical abundance, why would anyone risk dealing with nuclear energy at any level when its possible to get energy other ways... ",NEU
41033,u/shashankgarg97,RenewableEnergy,0.6397192478179932,2018-02-25 13:06,"Approximately around the mid of the 21st century, 80-90% of the electricity produced will be from low carbon sources. If nuclear energy advancements take place then we have dealt with solutions for terawatt energy level issues for another century keeping the environment pollution free. ",NEU
41034,u/shashankgarg97,RenewableEnergy,0.858410656452179,2018-02-25 13:08,solar energy won't play a major role in solving terawatt energy level issues. It is nuclear energy that will play a major role in another industrial revolution.,NEU
42259,u/Lethr,RenewableEnergy,0.8503872156143188,2018-05-01 00:40,that's a really weird and not very useful statistic. why not compare renewables and nuclear energy production both from the last decade,NEG
43227,u/tech01x,RenewableEnergy,0.7866066694259644,2018-06-21 11:59,"Of course it is a fair comparison. By their parallel nature, both solar PV and wind farms are far more likely to achieve operational status on time. It is an inherent advantage. This is especially stark when contrasting with nuclear energy.",POS
45295,u/Synod01,RenewableEnergy,0.7238476276397705,2018-09-05 15:20,"On an unrelated note.
Nuclear Energy doesn’t contribute to global warming. ",NEG
45928,u/boxdreper,RenewableEnergy,0.7622820734977722,2018-09-30 11:01,"OK, it's not renewable. Isn't the point of renewable energy to stop releasing CO2 into the atmosphere though? Nuclear energy is one of the fastest and most effective ways of doing that, even if it's not technically renewable. ",NEU
45937,u/strat_radford,RenewableEnergy,0.969723641872406,2018-09-30 14:07,Do you guys seriously just ban people who disagree with you on nuclear energy?  That's more than a little bit pathetic.  ,NEG
45944,u/kludgeocracy,RenewableEnergy,0.8690575957298279,2018-09-30 16:57,"Was the transition to nuclear energy in France a response to the oil crisis, or for some other reason?",NEU
47982,u/spadmin,RenewableEnergy,0.5515260100364685,2018-12-06 10:38,"So many people don’t realize how many flavors of nuclear energy plants can be created.

Renewables will sustain us until our power demands are higher than they can produce... that could be in a few thousand years but still at some point we will have an insane amount of robots terraforming the earth inside and out.",NEU
48334,u/dongasaurus_prime,RenewableEnergy,0.7086824178695679,2018-12-13 18:12,"The hilarious part is they had to spin off the nukes to their own company which was then nationalized as an easier method of subsidizing.

https://www.energydigital.com/power-generation/france-announces-plans-reduce-reliance-nuclear-power-increase-investment-edf

Nuclear energy is a parasite on the french taxpayer. ",NEG
50038,u/PluviusReddit,RenewableEnergy,0.701491117477417,2019-02-09 10:37,"Fear mongering isn't a good tactic.  I feel the best angle is pointing out that the need for nuclear energy is far diminished than it was 50 years ago.  Soon, we'll only need it in space and under water.",NEG
50318,u/spline_reticulator,RenewableEnergy,0.9101362228393555,2019-02-15 17:01,"I'm pretty sure there's a lot of vote manipulation and other moderating behavior that happens on this sub which isn't what would be considered good reddiquette. My other account was banned for saying that nuclear energy is a plausibly option for combating climate change. I've come to the conclusion that the moderators of this sub are really weird. You don't need to make information on renewable energy propaganda. People will just support it.

Anyway I'm sure this account will be banned now too. Nice knowing ya!",NEG
50322,u/PixelSplincher,RenewableEnergy,0.818274974822998,2019-02-15 22:36,What does nuclear energy have to do with renewable energy?,NEU
50377,u/MetalGearFoRM,RenewableEnergy,0.890633761882782,2019-02-17 11:03,Yeah they are. Nuclear energy is clean and safe.,POS
50508,u/dongasaurus_prime,RenewableEnergy,0.9619767069816589,2019-02-20 16:34,"Repurposed while simultaneously creating more dangerous waste for something not economical at all?

The best thing to do with nuclear waste is abandon nuclear energy entirely and stop making it. ",NEG
50696,u/Berkamin,RenewableEnergy,0.9020377993583679,2019-02-25 20:20,"Here's my biggest grievance with nuclear energy advocacy:

It presumes that humans are smart enough to figure out how to safely store radioactive waste for thousands of years, but too dumb to figure out how to store intermittent renewable energy for a few days.

&amp;#x200B;

Perhaps if someone had a working molten salt thorium reactor, I might pay attention. But at this point, I don't want us to be the ones making the bet. I hear India or China are investigating this. Let's see how it turns out.",NEG
51565,u/vmsabia,RenewableEnergy,0.5527119040489197,2019-03-24 04:54,"I’m sure I’m wrong, but doesn’t nuclear energy have way less of an environmental impact as other forms of energy, while being nearly as efficient?",NEU
51867,u/Akyrael,RenewableEnergy,0.8344690799713135,2019-03-31 10:48,"How about we store nuclear rods in your backyard via a government order?

Yes, nuclear energy can be part of the solution, but getting rid of appropiate regulations would only hurt people in the end, via cancer.",NEG
52262,u/leapinleopard,RenewableEnergy,0.6060704588890076,2019-04-05 14:31,Metaanalysis of studies on nuclear energy costs shows studies claiming it are economical contain conflicts of interests and illegitimately trim cost data leading to costs 6x lower than reality.  https://old.reddit.com/r/energy/comments/b9rt6g/metaanalysis_of_studies_on_nuclear_energy_costs/,NEG
53220,u/DonManuel,RenewableEnergy,0.9017871618270874,2019-05-09 12:13,"Renewables need no fuel at all and for construction you also don't need more than to build nuclear. So when we talk about mining of Uranium we talk about fuel and the most dirty waste possible from all available fuels. 

There's no fairness in your comparison and our rules are strict in this sub regarding the ""whitewashing of fossil or nuclear energy"". Therefore removed and you are now warned.",NEG
54034,u/Samwise_the_Tall,RenewableEnergy,0.9453845620155334,2019-05-30 19:24,"Nuclear energy is and has been a relatively clean source of power. The only downside is dealing with the waste, and also strategically placing reactors in safe areas. And yes, the Cheeto (Trump) is incredibly ignorant to most things, including climate science.",NEG
54587,u/illuminatedfeeling,RenewableEnergy,0.9552773833274841,2019-06-20 17:08,"Breeder reactors create dangerous plutonium, which can be used to make nuclear weapons. And the second round of plutonium processing is prone to many risks. Sorry, but nuclear energy has a waste disposal problem any way you cut it, no matter how often you call it ""safe.""",NEG
54951,u/Migoboe,RenewableEnergy,0.6918679475784302,2019-06-27 08:52,Well electrical generation really isn't the problem here in Finland and when they finally get Olkiluoto 3 online we have 1600MW more carbon free nuclear energy. I am very optimistic we can achieve zero emission electricity by 2035. But energy production produced only 17 Mtons of C02 equivalents in 2016 out of the Total 63 Mtons of CO2 equivalents produced.,POS
55269,u/Caffeine_Cowpies,RenewableEnergy,0.9704793691635132,2019-07-08 09:31,"So is this thread gonna be bombarded with those Nuclear Energy people who always seem to bash renewables, like solar and wind, because ""it's not sustainable"" 

It's almost getting to the point that I ignore those people just as much as those ""Rolling coal"" A-holes.",NEG
55276,u/Caffeine_Cowpies,RenewableEnergy,0.6356363892555237,2019-07-08 12:45,"I have been wondering that. 

Nuclear energy is much better than fossil fuels, and, if done properly, can be safer forms of energy. 

But you can't get people to ignore Chernobyl, Three Mile Island, and Fukushima. All 3 had their issues, but Chernobyl and Fukushima turned the towns next to them into ghost towns. 

Nuclear energy is like flying on commercial airplanes: Statistically very safe, but when it goes wrong, it goes REALLY badly for all involved.",NEU
56019,u/jandetlefsen,RenewableEnergy,0.7314527630805969,2019-07-28 00:09,"You often hear the argument that nuclear energy is necessary to ""secure the base load"" of the grid, but with the predicted increase of extreme hot days they are proven to not have the 100% uptime either.",NEG
56027,u/Nomriel,RenewableEnergy,0.8941550850868225,2019-07-28 01:14,"solar plummeted during both heatwave because with more than 35-40 degree in the surface pannel lose as much as 20% of their efficiency. 
the increase in solar insulation did nothing to counteract that. 
i checked regularly the energy production of my country during those heatwave. 

Nuclear energy was the only thing that saved us from electricity shortage.",NEG
56064,u/Nomriel,RenewableEnergy,0.7453972101211548,2019-07-28 02:31,"*slight* is not 20-50% of installed capacity. 
especially not when compared to nuclear energy who had to shut down less than 10% of it’s capacity due to the heat",NEG
56095,u/Nomriel,RenewableEnergy,0.6646283864974976,2019-07-28 03:56,"no don’t work on that it’s not necessary i know already. 

i’m not hating on solar energy or wind for that matter. 
i frequently invest in wind energy and plan to install panels on my house. 

i’m just saying that :
- heatwave doesn’t threaten nuclear energy
- the same heatwave also decrease renewables 
- you can’t attack nuclear energy on it’s unreliability. especially when we love and defend renewables.",NEU
56099,u/ObnoxiousFactczecher,RenewableEnergy,0.6035077571868896,2019-07-28 04:07,But I never attacked nuclear energy on unreliability. The only issues I've ever had with it were cost escalations.,NEG
57359,u/dontpet,RenewableEnergy,0.8547165393829346,2019-08-28 11:04,"&gt;Rosatom has accused Friends of the Earth and other NGOs of “hardline anti-nuclear activism … based on a position well known for being completely biased and riddled with factual errors”. It said its priority was “sustainable development” and that nuclear energy was “intrinsically immune to any form of political manipulation”.

LOL. I feel dirty just reading that. If this is wooing, we are in a dank bar in the lowest class part of town just before closing on a very drunk Saturday night.",NEG
58247,u/StonerMeditation,RenewableEnergy,0.9278383851051331,2019-09-24 15:41,"*""The cost of generating solar power ranges from $36 to $44 per megawatt hour (MWh), the WNISR said, while onshore wind power comes in at $29–$56 per MWh. Nuclear energy costs between $112 and $189.""*

Fossil Fuel and nuke energy are the past.

Renewables are the future.",NEU
58290,u/gibbsi,RenewableEnergy,0.8737162947654724,2019-09-25 02:33,"you also have nuclear waste to deal with, which has to be paid for centuries to manage. that's a big externality with nuclear energy which people don't seem to include often. risk too.",NEG
58393,u/BrotherStalin,RenewableEnergy,0.7835344672203064,2019-09-30 00:48,I don't think we are there yet to threaten nuclear energy yet.,NEU
59869,u/Arsnumeralis,RenewableEnergy,0.9000082612037659,2019-11-22 04:06,"Reduce energy needs, invest in diversification and nuclear energy as well.",NEU
59985,u/TekDragon,RenewableEnergy,0.7250244617462158,2019-11-30 19:50,"Doesn't the cost of solar/wind start increasing exponentially as production ramps up? That is, the cost of moving from 50% to 51% green is substantially more expensive than moving from 10% to 11%.

Unless there's some major breakthroughs on the energy storage front, it would seem to me like there's going to be a point at which nuclear energy becomes more cost effective than adding additional wind/solar.",NEU
60007,u/steroid_pc_principal,RenewableEnergy,0.8840777277946472,2019-12-01 10:30,"There’s no rule that says posting about nuclear energy isn’t allowed though. Plus, a post about the downsides of nuclear energy is clearly relevant to renewables.",NEU
60159,u/Akyrael,RenewableEnergy,0.9659153819084167,2019-12-05 12:54,"It's sad that you actually think your trolling means something to us. Is your life really that empty?

At least try and actually make a cogent argument for nuclear energy, instead of acting like you're 11.",NEG
60251,u/frickerooniosmebob,RenewableEnergy,0.49499475955963135,2019-12-07 14:37,Oh I don’t really know any of those I just kinda found this sub. Sorry if I’m off topic. Know any good nuclear energy forums?,NEG
60252,u/frickerooniosmebob,RenewableEnergy,0.731342077255249,2019-12-07 14:40,Also from looking at a lot of nuclear energy subs they seem to be very anti renewable energy which I kinda think both are good.,NEU
60715,u/sJAK95,RenewableEnergy,0.7219994068145752,2019-12-22 23:50,"Well if you want energy to be as cheap as possible then i suppose coal is the best alternative? Nuclear energy has been an alternative for coal for decades. If we want to remove coal, nuclear is by far the best solution. Renewable energy require enourmous land areas where it often is agriculture or nature while nuclear energy only needs a small area. Or are you one of those who are afraid of the least dangerous energy sources?",NEU
61293,u/b_33,RenewableEnergy,0.6561546921730042,2020-01-08 07:23,"Nuclear energy requires a fuel in the form of radioactive material. This material is finite, so by definition it is not renewable. I'm not an expert on this however so take what I am saying with a pinch of salt if you must, but I don't believe any radioactive waste can subsequently be re-used.

Edit: I stand corrected as apparently you can reuse uranium and thorium. Everyday is a school day.",NEU
61298,u/bonboncolon,RenewableEnergy,0.6476743817329407,2020-01-08 08:12,"It's like a grey area I suppose. While it won't warm the planet up, there's still wastage that is very dangerous and needs to be handled properly and delicately. Not to mention it's around for a long time.  


There's also the fact that it's very expensive. I think one of the most expensive in terms of energy, but don't quote me on that - renewables right now are far far cheaper and less dangerous. Regardless, nuclear energy places are being built. I believe one is planned to be built in Oxfordshire, England..",NEU
62404,u/markstopka,RenewableEnergy,0.6503307223320007,2020-02-11 12:43,"&gt; The cost to produce 1w of nuclear energy is much more expensive then solar.

vs. 

&gt; The cost to just build a nuclear facility can be north $1 billion for power generation of the same size.

😂

&gt; I work for the largest renewable energy contractor in North America and not a single company we compete with are getting into nuclear energy or are even contemplating it.

What a surprise, no bicycle manufacturer is competing with car manufacturers either; does not mean bicycles can go faster than cars.",NEU
63962,u/ComradePranu,RenewableEnergy,0.5794429183006287,2020-04-13 15:45,"Nuclear Energy is widely used among EU countries, and many forms of renewable energy are very impractical on a large scale.",NEU
65148,u/Some_Unholy_Skeptic,RenewableEnergy,0.7989243865013123,2020-05-09 04:51,"This. Nuclear energy's actually pretty benign in almost every plant. There's a reason that reactors have so many redundancies when it comes to biological shielding. The logistics of using nuclear are far more pressing, like you said. I seem to remember a plant in Germany or somewhere that cost a few billion euros that was never ""turned on"" so to speak due to Fukushima. The sad thing is, is with the phase-out of nuclear energy in Germany, a significant portion of that energy is back to being produced by fossil fuels.",NEU
65151,u/billdietrich1,RenewableEnergy,0.7705820798873901,2020-05-09 05:15,"&gt; The sad thing is, is with the phase-out of nuclear energy in Germany, a significant portion of that energy is back to being produced by fossil fuels.

Yes, one can argue that Germany got off nuclear too fast.  But that's a question of speed, not overall strategy.",NEG
66759,u/GingeraMan,RenewableEnergy,0.8006675243377686,2020-06-27 23:27,"This is why we need nuclear energy, at least for now.",NEU
66760,u/GingeraMan,RenewableEnergy,0.8245017528533936,2020-06-27 23:27,Then more nuclear energy for now then... Until renewables can take over,NEU
67635,u/Bojarow,RenewableEnergy,0.6638463735580444,2020-07-19 17:08,"Only now are you thinking that? It's been hard to ignore for years. He even had some nice words for Michael Moore because he attacked renewables in his ""documentary"". He didn't like it that much though, mostly because it propagated degrowth and didn't massively endorse nuclear energy.",NEG
67682,u/dontpet,RenewableEnergy,0.9728198647499084,2020-07-21 12:09,More corruption tied to the nuclear energy industry.,NEG
67734,u/Euphorbium,RenewableEnergy,0.8554131388664246,2020-07-23 07:37,"Well, maybe not ships, but everything else can. Ships could use nuclear energy.",NEU
68782,u/N3uroi,RenewableEnergy,0.8552073240280151,2020-08-13 09:57,"I'm not distracting or avoiding. Quite the contrary I would call you out for exactly that for trying to counter-argument the waste from renewables with the waste of another way of energy production. What difference does it make to waste that will need to be dealt with by using renewable sources if there exists any waste from nuclear energy? It doesn't influence it at all.

Or would you propose the same solution we used for nuclear waste to be appliead to ""renewables waste""? Guess what... old wind turbine blades are already buried because the aren't exactly (profitably) recyclable.",NEG
69421,u/Cammudar,RenewableEnergy,0.5312384963035583,2020-08-25 16:57,I love how one of the arguments used for nuclear energy is the extremely high energy density in uranium but they forget that almost all of it is wasted.,NEU
69425,u/bonjarno65,RenewableEnergy,0.7255063056945801,2020-08-25 17:38,"Nuclear energy sounds ""futuristic"" and people are ignorant of renewables+storage+demand flexibility",NEG
69429,u/Cammudar,RenewableEnergy,0.6388165950775146,2020-08-25 17:58,"Wait but I'm not saying it is a"",safe, clean, cheap or needed for baseload."" I'm just wondering why a weirdly large number of people think it is even when nuclear energy really isn't.",NEU
69443,u/Roland_Squared,RenewableEnergy,0.8556565642356873,2020-08-25 18:58,I think nuclear power generation has come to in actuality to be a growing number of very different things still all referred to by a blanket term nuclear energy. The classic produce a lot of toxic waste process is one. Fusion is another. Now there are ways to fuel nuclear power with types of nuclear waste from other processes.,NEU
69448,u/Cammudar,RenewableEnergy,0.8711115121841431,2020-08-25 19:06,"While there are a few potential applications to nuclear fuels and even waste processes, there have only been a few experimental studies for nuclear energy in other industrial processes but practically none have actually been used commercially. Fusion power really does have the potential of become a real, viable energy source, but we are at least 4 decades away from that ever becoming achievable and by then Solar and Wind will become so cheap and so inexpensive that the same processes that fusion could achieve will already have done by renewable at inexpensive costs.",NEU
70602,u/iPod3G,RenewableEnergy,0.8395941853523254,2020-09-19 14:23,"Ethanol is considered renewable because it is made from corn. Burning it releases carbon which, we all KNOW, is contributing to man-made climate change.   

Geothermal energy (pick any) is basically clean.

Nuclear energy?   What about the nuclear waste?",NEU
71130,u/friendtoearth,RenewableEnergy,0.8885416388511658,2020-10-02 12:32,"http://canteach.candu.org/Pages/Image%20Library.aspx     . This is the link to learn about the reactors, design and everything. When you go through you could understand on your own . Still if you feel you wanna know my findings you can contact me . I am not against nuclear energy but worried about the guy who wants to make profit from it .",NEU
71864,u/[deleted],RenewableEnergy,0.7888400554656982,2020-10-18 07:07,"Sounds like something a lobbyist would make up. Someone living in an off grid cabin in the woods would not be pushing hydrogen energy for the utilities. 

I’m not the one here pushing the proliferation of nuclear energy. What does it matter what I do?

Edit, I said nuclear when I meant hydrogen. My bad.",NEG
71865,u/solar-cabin,RenewableEnergy,0.6930828094482422,2020-10-18 07:20,""" Someone living in an off grid cabin in the woods would not be pushing nuclear energy for the utilities. ""

My profile is right there and I do not push nuclear.

Stop trying to get in to personal battles and stick to the topic.

If you want to get in to a pissing contest I suggest you pick someone more your size, squirt.",NEG
72074,u/Interesting-Current,RenewableEnergy,0.9632651209831238,2020-10-22 23:42,"Its stupid how much fossil fuels and nuclear energy are subsidised by the ""small government"" republicans",NEG
72127,u/Interesting-Current,RenewableEnergy,0.9488522410392761,2020-10-23 14:33,It sucks that so many people still believe that nuclear energy is cheaper,NEG
72601,u/Interesting-Current,RenewableEnergy,0.9734670519828796,2020-11-01 15:13,Saw this on r/technology and the comments were full of nuclear energy shills,NEG
72680,u/Interesting-Current,RenewableEnergy,0.9542641639709473,2020-11-02 16:25,Because nuclear energy is extremely expensive and creates nuclear waste,NEG
73449,u/adinsmore,RenewableEnergy,0.53913414478302,2020-11-17 02:37,"Seems you are a big advocate of nuclear energy, that's fine. However you clearly don't know the situation in Scotland. In 2019, 90.1% of Scottish electricity consumption was provided by renewable energy sources, mostly wind. Of course, there is still work to be done, but nuclear energy in Scotland would be like sending the army to arrest a pickpocket.",NEU
73575,u/Agent_03,RenewableEnergy,0.6332024931907654,2020-11-19 05:11,"I like it, but it concerns me that the GOP is trying to shoehorn nuclear into the mix. Nuclear energy is by far the slowest, most expensive solution to climate change -- $8-10 billion per reactor, and an average of [10 years of construction](https://www.reuters.com/article/us-energy-nuclearpower-idUSKBN1W909J).

Nuclear energy has been lobbying heavily to divert government funds that would better be spent on renewables.",NEG
74351,u/PM_ME_YOUR__BOOTY,RenewableEnergy,0.7729467153549194,2020-11-30 14:20,"How can the ""only hit net neutral""? PV panels produce more energy than was used to produce them in two years now.

Your facts seem a decade old.

And nuclear energy produces something not so clean.",NEG
74570,u/JustWhatAmI,RenewableEnergy,0.8867616057395935,2020-12-03 09:03,"&gt;You asked about nuclear, not renewables.

Ah, the old turn! Nuclear folks can't seem to go long without dumping on renewables, even if the topic is nuclear energy",NEG
